scheme_id,scheme_article,scheme_name,scheme_description
V/B.1.2.,Art. 22,(a) measures aimed at promoting knowledge and improving human potential through:,"Setting up of young farmers: the measure aims at facilitating both the initial establishment of farmers who are less than 40 years of age and who are setting-up for the first time, and the structural adjustment of their holdings after their initial setting up."
V/B.1.3,Art. 23,(a) measures aimed at promoting knowledge and improving human potential through:,"Early retirement of farmers and farm workers: this measure seeks to facilitate the structural adjustment of transferred holdings through the measure for the setting-up of young farmers, or by transferring the holding with a view to increasing its size. Support is available to farmers and farm workers aged at least 55 and deciding to definitely stopping their agricultural activity or stop farm work, respectively. This measure has been discontinued in the programming period 2014 – 2020."
V/B.1.4,Art. 24,(a) measures aimed at promoting knowledge and improving human potential through:,Use of advisory services by farmers and forest holders: the support for the use by farmers and forest holders of management and advisory services aims at allowing them to improve the sustainable management of their holdings. The support available under this measure contributes to covers the costs arising from the use of advisory services.
V/B.1.5,Art. 25,(a) measures aimed at promoting knowledge and improving human potential through:,"Setting up of farm management, farm relief and farm advisory services, as well as of forestry advisory services: the support available under this measure covers costs arising from the setting-up of farm management, farm relief and farm advisory services, as well as forestry advisory services."
V/B.1.6,Art. 26,(b) measures aimed at restructuring and developing physical potential and promoting innovation through:,"Modernisation of agricultural holdings: the purpose of  this measure is to modernize agricultural holdings to improve their economic performance through better use of the production factors he scope of the measure includes support for tangible and/or intangible investments for the introduction of new technologies and innovation, targeting quality, organic products and on/off-farm diversification, as well as improving the environmental, occupational safety, hygiene and animal welfare status of agricultural holdings."
V/B.1.7,Art. 27,(b) measures aimed at restructuring and developing physical potential and promoting innovation through:,"Improving the economic value of forests: this measure makes available support for private forests owners (or their associations) or for  Municipalities (or their associations) to carry out investments aiming at improving and broadening the economic value of their forests, or for increasing diversification of production and enhancing market opportunities."
V/B.1.8,Art. 28,(b) measures aimed at restructuring and developing physical potential and promoting innovation through:,Adding value to agricultural and forestry products: this measure provides support for tangible and/or intangible investments aiming at improving the processing and marketing of primary agricultural and forestry products.
V/B.1.9,Art. 29,(b) measures aimed at restructuring and developing physical potential and promoting innovation through:,"Cooperation for development of new products, processes and technologies in the agriculture and food sector and in the forestry sector: this measure supports and promotes cooperation between farmers, the food and the raw materials processing industry and other parties to ensure that the agriculture and food sector and the forestry sector can take advantage of market opportunities through widespread innovative approaches in developing new products, processes and technologies."
V/B.1.10,Art. 30,(b) measures aimed at restructuring and developing physical potential and promoting innovation through:,"Improving and developing infrastructure related to the development and adaptation of agriculture and forestry: the support covers operations related to access to farm and forest land, land consolidation and improvement, energy supply and water management."
V/B.1.11,Art. 20(b)(vi),(b) measures aimed at restructuring and developing physical potential and promoting innovation through:,Restoring agricultural production potential damaged by natural disasters and introducing appropriate prevention actions: the measure provides support for restorative and preventive measures against natural disasters as a means to contribute to the agricultural competitiveness axis.
V/B.1.12,Art. 31,"(c) measures aimed at improving the quality of agricultural production and products by:
","Helping farmers to adapt to demanding standards based on Community legislation: the aim of this measure is to promote a more rapid implementation by farmers of demanding standards based on Community legislation concerning the environment, public health, animal and plant health, animal welfare and occupational safety and the respect of those standards by farmers. The measure partly covers the costs incurred and income foregone caused to farmers to apply the standards. It has been discontinued in the 2014 – 2020 programming period."
V/B.1.13,Art. 32,"(c) measures aimed at improving the quality of agricultural production and products by:
","Supporting farmers who participate in food quality schemes: this measure provides support for farmers participating in Community or national food quality schemes in view of providing consumers with assurances on the quality of the product or the production process used as a result of their participation in such schemes, achieving added value for agricultural primary products and enhancing market opportunities."
V/B.1.14,Art. 33,"(c) measures aimed at improving the quality of agricultural production and products by:
",Supporting producer groups for information and promotion activities for products under food quality schemes: support is provided to producer groups to inform consumers and promote products provided under quality schemes supported by Member States within their rural development programmes in view of improving consumers’ awareness of the existence and specifications of products produced under the aforementioned quality schemes.
VB.1.15,Art. 34,"(d) transitional measures for the Czech Republic, Estonia, Cyprus, Latvia, Lithuania, Hungary, Malta, Poland, Slovenia and Slovakia concerning:",Supporting semi-subsistence agricultural holdings undergoing restructuring: support is provided under this measure to agricultural holdings which produce primarily for their own consumption. This transitional measure has been dismissed in the 2014 – 2020 programming period.
V/B.1.16,Art .35,"(d) transitional measures for the Czech Republic, Estonia, Cyprus, Latvia, Lithuania, Hungary, Malta, Poland, Slovenia and Slovakia concerning:",Supporting setting up of producer groups: support is provided to facilitate the setting-up and administrative operation of producer groups. This transitional measure has been dismissed in the 2014 – 2020 programming period.
V/B.1.17,Art. 25a  of  Regulation (EC) No 1974/2006,,Provision of farm advisory and extension services in Bulgaria and Romania.
V/B.1.18,Art. 35a,,Supporting holdings undergoing restructuring due to a reform of a common market organization
V/B.2.1,Art. 37,(a) measures targeting the sustainable use of agricultural land through:,"
Natural handicap payments to farmers in mountain areas: natural handicap payments in mountain areas contribute, through continued use of agricultural land, to maintaining the countryside, as well as to maintaining and promoting sustainable farming systems. 
"
V/B.2.2,Art. 37,(a) measures targeting the sustainable use of agricultural land through:,"Payments to farmers in areas with handicaps, other than mountain areas: natural handicap payments in in areas with handicaps, other than mountain areas contribute, through continued use of agricultural land, to maintaining the countryside, as well as to maintaining and promoting sustainable farming systems."
V/B.2.3,Art. 38,(a) measures targeting the sustainable use of agricultural land through:,"Natura 2000 payments and payments linked to Directive 2000/60/EC: these payments are available to farmers to help them to address specific disadvantages in the areas concerned resulting from the implementation of Council Directive 79/409/EEC on the conservation of wild birds, Council Directive 92/43/EEC on the conservation of natural habitats and of wild fauna and flora in order to contribute to the effective management of  Natura 2000 sites, as well as to help farmers to address disadvantages in river basin areas resulting from the implementation of Directive 2000/60/EC of the European Parliament and of the Council establishing a framework for the Community action in the field of the water policy."
V/B.2.4,Art. 39,(a) measures targeting the sustainable use of agricultural land through:,"Agri-environment payments: these payments cover costs incurred and income foregone incurred by farmers and other land managers for their voluntary commitments to  apply agricultural production methods compatible with the protection and improvement of the environment, the landscape and its features, natural resources, the soil and genetic diversity."
V/B.2.5,Art. 40,(a) measures targeting the sustainable use of agricultural land through:,Animal welfare payments: these payments cover costs incurred and income foregone incurred by farmers for their voluntary commitments to adopt standards of animal husbandry which go beyond the relevant mandatory standards.
V/B.2.6,Art. 41 ,(a) measures targeting the sustainable use of agricultural land through:,"Support for non-productive investments: Support is available for non-remunerative investments where they are necessary to achieve the commitments undertaken under agri-environmental schemes or other agri-environmental objectives, or where they enhance on-farm the public amenity value of Natura 2000 areas and other areas of high natural value."
V/B.2.7,Art. 43,(b) measures targeting the sustainable use of forestry land through:,"First afforestation of agricultural land: the support is provided to farmers for first afforestation of agricultural land, i.e. where agricultural practices were undertaken. The payments cover establishment and maintenance costs as well as income foregone resulting from afforestation."
V/B.2.8,Art. 44,(b) measures targeting the sustainable use of forestry land through:,First establishment of agroforestry systems on agricultural land: the support is granted to farmers to create agroforestry systems combining extensive agriculture and forestry systems. The support covers establishment costs.
V/B.2.9,Art. 45,(b) measures targeting the sustainable use of forestry land through:,"First afforestation of non-agricultural land:  the support is provided for afforestation of land that was not under agricultural cultivation. The payments include the establishment costs and in the case of abandoned farmland, also an annual premium."
V/B.2.10,Art. 46,(b) measures targeting the sustainable use of forestry land through:,Natura 2000 payments: aims at providing support to private forest owners or associations in order to compensate for costs incurred and income foregone resulting from the restrictions on the use of forests and other wooded land related to the correct implementation of Directives 79/409/EEC and 92/43/EEC.
V/B.2.11,Art. 47,(b) measures targeting the sustainable use of forestry land through:,Forest-environment payments: this support is for beneficiaries who make voluntary forest-environmental commitments for a period between five and seven years.
V/B.2.12,Art. 48,(b) measures targeting the sustainable use of forestry land through:,Restoring forestry potential and introducing prevention actions:  this support is for restoring forestry potential in forests damaged by natural disasters and fire and for introducing appropriate prevention actions. 
V/B.2.13,Art. 49,(b) measures targeting the sustainable use of forestry land through:,Support for non-productive investments: this support is available for investments carried out in forests linked to the achievement of commitments undertaken pursuant to the forest-environment measure or other environmental objectives and which enhance the public amenity value of forest and wooded land of the area concerned.
V/B.3.1,Art. 53,"(a) measures to diversify the rural economy, comprising:",Diversification into non-agricultural activities: this measure aims at providing support for rural people to diversify farming activities towards non-agricultural activities and develop non-agricultural sectors and promote employment.
V/B.3.2,Art. 54,"(a) measures to diversify the rural economy, comprising:",Support for the creation and development of micro-enterprises with a view to promoting entrepreneurship and developing the economic fabric: this measure aims at diversifying farming activities towards non-agricultural activities with the help of supporting the set-up of micro-enterprises that facilitate entrepreneurship in rural areas.
V/B.3.3,Art. 55,"(a) measures to diversify the rural economy, comprising:","Encouragement of tourism activities: the support covers small-scale infrastructure such as information centres and the signposting of tourist sites, recreational infrastructure such as that offering access to natural areas and small-capacity accommodation and the development and/or marketing of tourism services relating to rural tourism."
V/B.3.4,Art. 56,"(b) measures to improve the quality of life in the rural areas, comprising:","Basic services for the economy and rural population: this measure supports the improvement of basic services, including local access to Information and Communication Technologies (ICTs) and carry out investments. The measure includes support for setting up of basic services, including cultural and leisure activities, concerning a village or group of villages, and related small-scale infrastructure."
V/B.3.5,Art. 52(b)(ii),"(b) measures to improve the quality of life in the rural areas, comprising:",Village renewal and development: this measure aims at supporting village development.
V/B.3.6,Art. 57,"(b) measures to improve the quality of life in the rural areas, comprising:","Conservation and upgrading of the rural heritage: this measure support for the drawing-up of protection and management plans relating to Natura 2000 sites and other places of high natural value, environmental awareness actions and investments associated with maintenance, restoration and upgrading of the natural heritage and with the development of high natural value sites. The measure also supports studies and investments associated with maintenance, restoration and upgrading of the cultural heritage."
V/B.3.7,Art. 58,(c),"A training and information measure for economic actors operating in the fields covered by axis 3: this measure aims to enhance the human potential in rural areas to achieve the objectives of diversifying farming activities towards non-agricultural activities and develop non-agricultural sectors, promote employment, improve basic services and carry out investments."
V/B.3.8,Art. 59,(d),"A skills acquisition and animation measure with a view to preparing and implementing a local development strategy. Under this measure, support is provided for studies about the area and the local development strategy, for example the training of staff involved in the preparation and implementation of a local development strategy; promotional events and the training of leaders; implementation by public-private partnerships."
V/B.4.1,Art. 63 ,(a) Local development strategies:,Competitiveness (Measure 411)
V/B.4.2,,(a) Local development strategies:,Environment/land management  (Measure 412)
V/B.4.3,,(a) Local development strategies:,Quality of life/diversification (Measure 413)
V/B.4.4,Art. 68(2)(b),,Transnational and inter-regional cooperation 
V/B.4.5,Art. 63(c),,"Running the local action group, skills acquisition, animation"
V/B.4.6,Art. 66 ,,Technical assistance
V/B.4.7,Art. 39a  of Regulation  (EC) No 1974/2006,,Complementary direct payments in Bulgaria and Romania (Measure 611)
VI/A.1,,Information and promotion measures ,"Information provision and promotion measures concerning agricultural products and certain food products based on agricultural products implemented in the internal market or in third countries as listed in Regulation (EU) No 1144/2014 may be fully or partly financed by the Union budget, subject to the conditions laid down in this Regulation. These measures shall take the form of information and promotion programmes."
VI/B.1,,Information and promotion measures,"Information and promotion measures for agricultural products and their method of production as well as for food products based on agricultural products carried out on the internal market or in third countries as listed in Article 2 of Regulation (EC) No 3/2008 may be financed, fully or in part, by the Community budget subject to the conditions laid down in this Regulation. These measures shall be implemented as part of an information and promotion programme."
VI/C.1,,POSEI ,"Aid granted for the following measure:
POSEI is a specific agricultural scheme aiming at taking into account the constraints of the Outermost Regions as required by Article 349 TFEU. It consists of two main elements: the specific supply arrangements and the measures to support local production. The former aims at mitigating additional costs for supplying essential products resulting from the remoteness of these regions (through aid for products from the EU and exemption from import duties for products from third countries) and the latter at assisting the development of the local agriculture sector (direct payments and market measures). POSEI also allows the financing of plant-health programmes."
VI/D.1,,Smaller Aegean Islands,"Aid granted for the following measure:
The regime for the Smaller Aegean Islands is similar to POSEI but does not have the same legal basis in the Treaty and operates on a smaller scale than POSEI. It includes both the specific supply arrangements (limited however to aid for products from the EU) and the measures to support the local agricultural activities consisting in top-up payments for specifically defined local products."
